Texts,Sentiment
Finnish sports equipment maker Amer Sports Oyj ( HEL : AMEAS ) said today that its net loss narrowed to EUR 16.9 million ( USD 22.3 m ) in the second quarter of 2010 from EUR 23.2 million in the corresponding period a year earlier .,2
"Finnish steel maker Rautaruukki Oyj ( HEL : RTRKS ) , or Ruukki , said today its net loss contracted to EUR 49 million ( USD 68.2 m ) for the first nine months of 2010 from EUR 229 million for the same period a year ago .",2
"For the first nine months of 2010 , Talvivaara 's net loss narrowed to EUR 8.3 million from EUR 21.9 million for the same period of 2009 .",2
"In the first nine months of 2010 , the company 's net loss narrowed to EUR 415,000 from EUR 7.4 million for the corresponding period of 2009 .",2
"In the first nine months of 2010 , the company 's net loss narrowed to EUR415 ,000 from EUR7 .4 m for the corresponding period of 2009 .",2
"( ADP News ) - Feb 9 , 2009 - Finnish computer services company Proha Oyj ( HEL : ART1V ) said today its net loss narrowed to EUR 113,000 ( USD 146,000 ) for 2008 from EUR 1.2 million for 2007 .",2
The new factory working model and reorganisations would decrease Nokian Tyres ' costs in the factory by EUR 30 million ( USD 38.7 m ) .,2
20 October 2010 - Finnish metal products company Componenta Oyj HEL : CTH1V said yesterday that its net loss narrowed to EUR7m for the first nine months of 2010 from EUR23 .3 m for the same period of 2009 .,2
Finnish fibers and plastic products maker Suominen Corporation said its net loss narrowed to 1.6 mln euro $ 2.0 mln in the first nine months of 2006 from 2.16 mln euro $ 2.7 mln in the same period of 2005 .,2
"In contrast , the company 's net loss for the third quarter of 2009 contracted to EUR 76 million from EUR 256 million for the corresponding period a year ago .",2
"In the second quarter of 2010 , Raute 's net loss narrowed to EUR 123,000 from EUR 1.5 million in the same period of 2009 .",2
"ADP News - Nov 13 , 2008 - Finnish printed circuit board PCB maker Aspocomp Group Oyj OMX : ACG1V said today that its net loss narrowed to EUR 2 million USD 2.5 m in the first nine months of 2008 from EUR 57",2
"Metsaliitto , however , narrowed its net loss for the second quarter of 2007 to 5.0 mln euro $ 6.9 mln from 61 mln euro $ 83.7 mln a year ago .",2
"narrows to EUR2 .8 m 9-mo '09 29 October 2009 - Finnish software and hardware developer Elektrobit Oyj HEL : EBG1V , or EB , said today that its net loss narrowed to EUR2 .8 m for the first nine months of 2009 from EUR35 .6 m for the same period a year ago .",2
The diluted loss per share narrowed to EUR 0.27 from EUR 0.86 .,2
Unit costs for flight operations fell by 6.4 percent .,2
The loss for the third quarter of 2007 was EUR 0.3 mn smaller than the loss of the second quarter of 2007 .,2
Airvana 's UMTS Home Base Station femto cell uses software-based functionality and off-the-shelf silicon to accelerate feature development and reduce product cost .,2
"According to Sepp+ñnen , the new technology UMTS900 solution network building costs are by one-third lower than that of the building of 3.5 G networks , operating at 2,100 MHz frequency .",2
The costs of the new ropax vessels are 30 % lower than those of the present ones .,2
The program 's target is structural cost reductions of about EUR 30mn in 2009 .,2
UPM-Kymmene is working closely with its shipping agents to reduce fuel consumption and greenhouse gas emissions .,2
"In August-October 2010 , the company 's result before taxes totalled EUR 9.6 mn , up from EUR 0.5 mn in the corresponding period in 2009 .",2
Finnish Bore that is owned by the Rettig family has grown recently through the acquisition of smaller shipping companies .,2
The plan is estimated to generate some EUR 5 million ( USD 6.5 m ) in cost savings on an annual basis .,2
"Finnish pharmaceuticals company Orion reports profit before taxes of EUR 70.0 mn in the third quarter of 2010 , up from EUR 54.9 mn in the corresponding period in 2009 .",2
"Finnish Sampo Bank , of Danish Danske Bank group , reports profit before taxes of EUR 152.3 mn in 2010 , up from EUR 32.7 mn in 2009 .",2
"Profit after taxes for the period was up to EUR0 .9 m , from EUR0 .01 m last year .",2
"Profit before taxes was EUR 5.4 mn , up from EUR 3.6 mn a year earlier .",2
"For the current year , Raute expects its net sales to increase and the operating result -- to be positive .",2
"Turnover surged to EUR61 .8 m from EUR47 .6 m due to increasing service demand , especially in the third quarter , and the overall growth of its business .",2
"As a result , the company currently anticipates net sales to increase and the operating result to be positive .",2
"Asimilar agreement was signed between China Mobile Ltd. ( SEHK : 0941 and NYSE : CHL ) , the largest mobile carrier , and theGPS and social networking service provider , promoting GyPSii service before Beijing 2008 Olympic Games , according to thelatest news .",2
"`` UPM 's deliveries increased during the third quarter by 4 percent , and the efficiency of operations improved , '' Chief Executive Jussi Pesonen said .",2
"Global sports equipment maker Amer Sports Corp. , whose brands include Atomic , Salomon and Wilson , saw a 64 percent increase in third-quarter net profit to EURO 47.4 million $ 65 million on strong sales and cost cuts .",2
"Due to rapid expansion , the market share of Tallink in terms of passenger carriage through Tallinna Sadam Port of Tallinn totaled 55 percent in November against 45.7 percent in November 2005 .",2
"Finnish industrial investor Panostaja Oyj OMX Helsinki : PNAAS OMX Helsinki : PNABS said on Friday 11 July that it has signed a deal to acquire the entire share capital of Kospa Oy , the manufacturer of waste disposal equipment .",2
"Stora Enso R shares rose 1.20 pct to 11.84 eur , UPM-Kymmene was also dragged higher , rising 1.68 pct to 17.56 eur and M-Real B added 2.38 pct to 4.30 eur .",2
Both loans will be used to finance strategic investments such as shopping center redevelopment projects and refinancing of maturing debt .,2
"The stock price rose 70.0 ores or 0.9 % to close at SEK77 .65 , ending a two-day streak of losses .",2
"Earnings per share ( EPS ) amounted to EUR0 .98 , up from the loss of EUR0 .02 .",2
"Earnings per share ( EPS ) were EUR0 .03 , up from the loss of EUR0 .083 .",2
"Operating profit totalled EUR 0.4 mn , up from an operating loss of EUR 0.8 mn year-on-year .",2
"Operating profit totalled EUR 7.0 mn , up from a loss of EUR 4.0 mn in the second quarter of 2009 .",2
Operating result including non-recurring items rose to EUR 146mn from a loss of EUR 267mn in 2009 .,2
"Tiimari , the Finnish retailer , reported to have geenrated quarterly revenues totalling EUR 1.3 mn in the 4th quarter 2009 , up from EUR 0.3 mn loss in 2008 .",2
"Earnings per share EPS amounted to EUR0 .03 , up from the loss of EUR0 .08 .",2
"Operating profit totalled EUR 5.8 mn , up from a loss of EUR 1.7 mn in the fourth quarter of 2009 .",2
"Operating profit was EUR 0.6 mn , up from a loss of EUR 19mn a year earlier .",2
The investments and operational changes enable additional optimisation of the working hours and thereby further cost savings of some 7 % -9 % .,2
"Okmetic 's products are based on high-tech expertise that generates added value for customers , innovative product development and an extremely efficient production process .",2
"9 September 2010 - Finnish stationery and gift retailer Tiimari HEL : TII1V said today its net sales rose by 2 % year-on-year to EUR5 .7 m in August 2010 , driven by growth in Finland , while demand in the Baltics remained weak .",2
"By 14:29 CET on Monday , shares in Bavarian Nordic had climbed 1.21 % to DKK250 on the stock exchange in Copenhagen after having lost 7.41 % in the past month .",2
"For example , net sales increased by 5.9 % from the first quarter , and EBITDA increased from a negative EUR 0.2 mn in the first quarter of 2009 .",2
"Mobile phone sales rose 25 % to 5.87 billion euros , while enterprise solution sales dropped 39 % to 186 million euros .",2
Sponda will record a profit from the sale of 8.5 mln euro ($ 12.4 mln).,2
"Cencorp estimates that its net sales in the last quarter will be as earlier stated , EUR4 .3 m to EUR5 .0 m , and operating profit (EBIT)is estimated to be positive .",2
`` Our customer has been satisfied with Basware Invoice Automation solution and extends the implementation to new geographies .,2
Repeats sees 2008 EBITA above 18 pct of sales .,2
` By separating side businesses we will be able to faster expand and develop Tapro retail network .,2
"` Our strategic cooperation with Rentakran brings us new customers and already-working relationships with the authorities of the new territories , ' said Jarmo Laasanen , a senior manager at Cramo .",2
"`` After the share purchase is completed , financing will also be provided to expand Latvia 's broadband infrastructure and to develop new areas of business , including acquisitions of other companies . ''",2
"`` In terms of profitability and earnings 2007 was the best year in our history , '' Chief Executive Veli-Matti Mattila said .",2
`` The Government has had a very professional approach in assessing the offer .,2
"`` The margarine business has been put into good shape in the last two years , making it a natural addition to Bunge , which is looking to leverage its position in the Central and Northern European markets , '' Raisio CEO Matti Rihko said in a statement .",2
`` This is a win for all OEMs targeting to develop WiMAX products .,2
"A portion , $ 12.5 million , will be recorded as part of its winnings in a prior patent dispute with Finnish phone maker Nokia Oyj .",2
"Finnish electronics manufacturing services company Elcoteq signing a cooperation agreement with a Japanese mobile phone manufacturer , bypasses Elcoteq Tallinn , says Jan Kotka , CEO of Elcoteq Tallinn .",2
"According to A-Rehu 's Managing Director , Jouko Lahtinen , the project will stabilise costs and improve supply security .",2
"According to CEO Matti Karppinen , Frozen Foods posted a good result in 2010 , as it did in 2009 .",2
"According to Viking Line 's Managing Director , Nils-Erik Eklund , the company 's Board of Directors is very satisfied with Viking Line 's performance .",2
Actions to improve operational efficiency and adjust operations are expected to deliver annualised permanent cost savings of around EUR 4.5 million and will be effected mostly during the first half of 2010 .,2
"At the same time , sales development in Russia was boosted by the opening of Stockmann Nevsky Centre in St Petersburg .",2
"Benefon , a wireless and GPS technology company , will supply Karputer with its TWIG navigation platform , a GPS satellite navigation and voice guidance service .",2
"Biohit and VWR have been in close cooperation for a number of years in the US , where Biohit is one of VWR 's focus suppliers .",2
Combining this deep domain expertise with our Application Service Management ASM and outsourcing service offerings has now proved to be a winning combination .,2
Demand was brisk as expected and order levels have remained high .,2
"During the past decade it has gradually divested noncore assets and bought several sports equipment makers , including California-based Fitness Products International and Sparks , Nevada-based ATEC , a leading maker of baseball and softball pitching machines .",2
Espoon kaupunki awarded contracts for personal care products .,2
"Exports accounted for 65.4 % of net sales , representing an all time record for the company .",2
Finland 's Poyry Energy has won a contract to advise builders of a new cogeneration power plant in Lithuania 's second-biggest city of Kaunas and to supervise the construction process .,2
"Finnish construction company YIT Oyj said on November 13 , 2007 it won a 70 mln euro $ 102.8 mln contract to construct the new office building for local property company Tapiola Real Estate Oy .",2
"In 2006 , Kone received an order from Aker Yards to supply 43 customised elevators for the very first Genesis cruise ship which is scheduled to be completed in 2009 .",2
"In addition to fireplace exports , demand for lining stone has exceeded the level of the earlier part of the year and will continue to be clearly brisker for the remainder of the year .",2
Kalmar has been awarded a new 5-year contract to supply its Rough Terrain Container Handler RTCH .,2
Major Order in India Comptel Corporation has received a significant long-term order for mediation and provisioning solutions being used by a leading operator in India .,2
Managing Director Kari Inkinen says that Sponda 's leasing operations developed highly favourably .,2
Net cash flow from operations is expected to remain positive .,2
"Of the price , Kesko 's share is 10 mln euro $ 15.5 mln and it will recognize a gain of 4.0 mln euro $ 6.2 mln on the disposal which will be included in the result for the second quarter of 2008 .",2
Olvi has posted a strong set of figures for the first six months of this year .,2
Operating profit improved by 27 % to EUR 579.8 mn from EUR 457.2 mn in 2006 .,2
Our standardised services have met with a positive reception among our customers as well as at Itella .,2
Performance in the second half of 2009 exceeded expectations .,2
Ponsse projects the forest machine markets to improve more than expected in 2010 from the previous year .,2
"Ragutis , which is based in Lithuania 's second-largest city Kaunas , boosted its sales last year 22.3 per cent to 36.4 million liters .",2
"Raisio 's bid to buy Glisten is a `` win-win '' deal for both companies , the chairman of the UK snacks firm told just-food today 10 February .",2
Stora Enso owns 43 percent of Bergvik and earns therefore SEK 1.5 bn on the value appreciation .,2
Talvivaara also maintains its assumption of turning cash flow positive before the year end .,2
"Thanksto improvements in demand and the adjustments we have made , theutilization rates of Cramo 's fleet have substantiallyimproved . ''",2
The acquisition is expected to improve access to chrome ore resources in Turkey .,2
The aim is an annual improvement in Ruukki Construction 's operating profit of more than EUR 3 million USD 4.1 m starting in 2009 .,2
"The company estimates that the trend in demand for sports equipment will be steady in 2006 , '' Amer 's report said .",2
The estimated synergy benefits are at least EUR7m annually .,2
The Group 's business is balanced by its broad portfolio of sports and presence in all major markets .,2
The objective of the planned measures is to achieve significant savings in the next few years .,2
The rebuilds are designed to improve the machines ' performance and product quality .,2
"The transaction will have a positive impact of around EUR2m on earnings , which Ruukki will recognize during the fourth quarter of this year .",2
"When the situation normalises , the company will be able to increase the amount of residential units for sale in St Petersburg and Moscow , in particular .",2
"` This is a repeat order to follow successfully installed 159 elevators in the same Delhi metro system , ' Kone spokeswoman told Thomson Financial News .",2
"`` Our customers now have the chance to make bookings for all the services they want at one location , '' said Mikko Tuomainen , in-charge of Finnair 's Internet ( sales ) .",2
`` Stonesoft sees great promise in the future of IPv6 .,2
`` The combined activities will create value for shareholders and be good for our employees and customers .,2
`` The trend in the sports and leisure markets was favorable in the first months of the year .,2
"`` We continued actively to focus R&D and to position our offering away from point solutions towards dynamic end-to-end solutions , '' Ervio stated .",2
16 February 2011 - Finnish industrial machinery company Metso Oyj ( HEL : MEO1V ) said today it will deliver minerals processing equipment and basic engineering to Canadian miner Northland Resources ( OSL : NAUR ) ( TSE : NAU ) .,2
27 January 2011 - Finnish IT solutions provider Affecto Oyj ( HEL : AFE1V ) said today it has won a EUR1 .2 m ( USD1 .6 m ) contract from state-owned Lithuanian Social Insurance Institution ( SODRA ) .,2
"According to Finnish pension insurance company Varma , Varma was the recipient of over two thirds of the revenue of the earnings-related pension cover that was under competitive tendering in Finland .",2
Finnish construction group Lemmink+ñinen has been awarded two road building contracts by the Lithuanian transport administration .,2
"Finnish construction group YIT has been awarded a contract to install heating , air conditioning and cooling systems to the new head office of the automobile association ADAC in Munich in Germany .",2
"Finnish flexible packaging manufacturer Suominen Corporation reports net sales of EUR 54.5 mn in the first quarter of 2008 , compared with EUR 54.3 mn a year earlier .",2
Finnish forest machinery manufacturer Ponsse has agreed with Volvo on the start of cooperation in Latin America .,2
"Finnish Metso Paper has been awarded a contract for the rebuild of Sabah Forest Industries ' ( SFI ) pulp mill in Sabah , Malaysia .",2
"Finnish Metso Paper has won an order to supply an uncoated fine paper machine to MCC Paper Yinhe , in China .",2
Finnish Outokumpu Technology has been awarded several new grinding technology contracts .,2
Finnish Rautaruukki has been awarded a contract to supply and install steel superstructures for the Partihallsf+Ârbindelsen bridge in Gothenburg in Sweden .,2
"Lule+Ñ municipality has awarded YIT a 2-year contract , for property management of about one third of the municipality 's properties , with a total area of 140,000 sq. metres .",2
"The shopping center to be opened in St. Petersburg , Russia in November 2010 will turn the cash flow of Finnish department store chain Stockmann 's Russian operations positive for the first time in 2011 .",2
"According to Atria 's President and CEO Matti Tikkakoski , the company 's Swedish operations significantly improved in the first quarter .",2
"According to CEO Kai Telanne , the company 's newspapers achieved the best financial result ever .",2
"According to Kesko , the company agreed with the city administration about lease of the building in 2006 , its resettlement and construction of a five-star hotel Hilton for 120 rooms .",2
"According to Nordic financial group Nordea 's analyst Sami Sarkamies , this makes Nokia 's portfolio competitive again .",2
"According to Ringman , Finnish paper companies have acquired know-how and capacity in paper recycling , which has turned out to be a successful strategy .",2
"According to Schmardin , Nordea will most likely try to win customers over from other pension fund providers .",2
"According to the CEO of Nordea Bank Estonia Vahur Kraft , Nordea Finland and Stockmann have been cooperating for more than ten years .",2
"Adanac Molybdenum of Canada has ordered grinding technology for its molybdenum project in British Columbia , Canada , while Shalkiya Zinc of Kazakhstan has awarded a contract for grinding technology for the Shalkiya zinc-lead project in Kazakhstan .",2
All of Raisio 's divisions recorded an operating profit .,2
"And the broker repeated its ` buy ' rating , based on expectations that current restructuring will lead to a clear improvement in performance in Europe in 2007 .",2
"Arvo Vuorenmaa , the Loviisa plant 's general manager said the application for the new licence was a `` standard '' procedure and that he was `` quite confident '' about approval being granted .",2
"As a domestic business , Best-In is already close to Finnish dog owners .",2
"BasWare 's CEO Ilkka Sihvo comments in conjunction with the Interim Report : `` As a whole , BasWare succeeded well in the second quarter of 2007 .",2
Cash flow from operating activities is estimated to be positive .,2
Cision says the sale will return its U.K. operation to profitability .,2
"Citigroup , Inc ( NYSE : C ) has announced that its Global Transaction Services ( GTS ) business has been awarded a new mandate by Finland-based Pohjola Bank Group .",2
"Comptel , a vendor of dynamic Operations Support System ( OSS ) software , has been selected by Orascom Telecom ( OTH ) as partner for provisioning and activation solutions for mobile services .",2
"Department store sales improved by 14 % to EUR 1,070.6 mn .",2
DMASIA-16 August 2006-Benefon extends manufacturing capability with ASMobile -® 2006 Digitalmediaasia.com & DMA Ltd. .,2
"Finland 's national carrier Finnair PLC carried a record 8.5 million passengers in 2005 , an increase of 4.5 percent on the previous year , the airline reported Tuesday .",2
"Finnair PLC carried a record 8.8 million passengers in 2006 , an increase of 3.5 percent on the previous year , the Finnish national carrier reported Tuesday .",2
"Finnish consulting and engineering group Poyry Plc ( OMX Helsinki : POY ) said on Wednesday ( 1 October ) that it has been awarded a contract by Tanqia Dibba FZC as owner-engineer for the wastewater system of Dibba , Emirate of Fujairah , UAE .",2
"Finnish financial solutions developer Basware Corporation ( OMX Helsinki BAS1V ) said on Tuesday ( 23 September ) that it will deliver a complete Invoice Automation solution to a large US engineering , construction and technical services organization .",2
Finnish handling systems company Cargotec Oyj ( HEL : CGCBV ) said today that it won a EUR 13 million ( USD 16.6 m ) contract to deliver MacGregor hatch covers for ships ordered by Norwegian shipowner Grieg Shipping .,2
Finnish operator Elisa and Aker Yards have signed a long-term service deal through which Elisa will deliver all necessary voice and data services for Aker Yards in Finland .,2
"Finnish steel maker Rautaruukki Oyj ( Ruukki ) said on July 7 , 2008 that it won a 9.0 mln euro ( $ 14.1 mln ) contract to supply and install steel superstructures for Partihallsforbindelsen bridge project in Gothenburg , western Sweden .",2
"Fiskars has a strong portfolio of international brands , which include Fiskars , Iittala , Gerber , Silva and Buster .",2
"For Teleste , the acquisition marks an entry into services business in a market where it has long been an established and significant supplier of products .",2
"Forestries were also higher , driven by yesterday 's bullish analyst comment on Stora Enso in Dagens Industri , dealers said .",2
"Furthermore , efficiency improvement measures initiated earlier are now bearing fruit , '' CEO Jan Lang said .",2
Global Banking News - 28 September 2010 Tieto Corporation and Pohjola Bank ( PINK : POJLF ) are to cooperate on SWIFT services .,2
Hearst will be able to consolidate about 20 % of all Russian market for advertising in press after the purchase .,2
"Helsingin Uutiset , Vantaan Sanomat and Lansivayla reach some 385,000 readers , or more than 40 % of the consumers in the greater Helsinki region .",2
"HELSINKI ( AFX ) - Metso said it will upgrade one of UPM-Kymmene 's four paper machines at the latter 's mill in Jaemsaenkoski with a new coating color supply system , machine and process controls and quality measurements .",2
"However , Simdax will remain available in the markets where it already has been approved as it has marketing authorisations or submitted applications in more than 40 countries , Orion added .",2
"However , the broker gave an `` outperform '' recommendation on the stock .",2
"However , the total orders received will still be above last year s levels .",2
"In accordance with our strategy , we strengthened our local presence by establishing a representative office in South Africa in October .",2
"In addition , Lehdentekijat Oy will start producing a new membership magazine , Viisas Raha ( Wise Money ) for the Association .",2
"In future , the company intends to look for know-how from outside the company and to cooperate with other actors in the sector .",2
Industry Investment is very interested in Glaston 's solar energy projects .,2
It is now the leading private road ambulance service company in Finland .,2
"Known as Post Bank , the concept would see Fidelity Bank rolling out 75 offices in Ghana Post premises , to provide financial services to the people .",2
"Kone 's factory located at Ayanambakkam , a suburb to the west of Chennai , is a fully integrated facility which gives it the capability to address costs .",2
Last year SysOpen Digia invested in IBM product know-how in the building of portal and trading place systems and successfully implemented customer solutions supported by it .,2
"( ADP News ) - Oct 1 , 2008 - Finnish consulting and engineering company Poyry Oyj ( OMX : POY1V ) said today it was awarded a EUR 5.2 million ( USD 7.4 m ) extension to their existing consultancy engineering contract with Venezuel",2
"( ADP News ) - Oct 31 , 2008 - Finnish food company Raisio Oyj ( OMX : RAIVV ) said today that its net profit jumped to EUR 16.4 million ( USD 20.9 m ) for the first nine months of 2008 from EUR 1.1 million for the same period of 2",2
"( ADP News ) - Sep 30 , 2008 - Finnish security and privacy software solutions developer Stonesoft Oyj said today that it won a USD 1.9 million ( EUR 1.3 m ) order to deliver its StoneGate network security products to an unnamed Russian te",2
"Meanwhile , Electrowatt-Ekono Philippines , Inc. was also awarded a three-year operation and maintenance ( O&M ) contract by FR Cement Corporation .",2
"Meanwhile , Nokia said that it will be able to deliver a complete range of services from deployment operations to consulting and integration to managed services as a result of the buyout .",2
"Nevertheless , Fitch notes that the business fundamentals of the three banks currently remain sound .",2
