Texts,Sentiment
"The international electronic industry company Elcoteq has laid off tens of employees from its Tallinn facility ; contrary to earlier layoffs the company contracted the ranks of its office workers , the daily Postimees reported .",0
A tinyurl link takes users to a scamming site promising that users can earn thousands of dollars by becoming a Google ( NASDAQ : GOOG ) Cash advertiser .,0
"Compared with the FTSE 100 index , which rose 36.7 points ( or 0.6 % ) on the day , this was a relative price change of -0.2 % .",0
"Compared with the FTSE 100 index , which rose 94.9 points ( or 1.6 % ) on the day , this was a relative price change of -0.4 % .",0
One of the challenges in the oil production in the North Sea is scale formation that can plug pipelines and halt production .,0
"Jan. 6 -- Ford is struggling in the face of slowing truck and SUV sales and a surfeit of up-to-date , gotta-have cars .",0
Peer Peugeot fell 0.81 pct as its sales rose only 6.3 pct from the same period last year .,0
Pharmaceuticals group Orion Corp reported a fall in its third-quarter earnings that were hit by larger expenditures on R&D and marketing .,0
"However , the growth margin slowed down due to the financial crisis .",0
"2009 3 February 2010 - Finland-based steel maker Rautaruukki Oyj ( HEL : RTRKS ) , or Ruukki , said today it slipped to a larger-than-expected pretax loss of EUR46m in the fourth quarter of 2009 from a year-earlier profit of EUR45m .",0
"( ADPnews ) - Feb 3 , 2010 - Finland-based steel maker Rautaruukki Oyj ( HEL : RTRKS ) , or Ruukki , said today it slipped to a larger-than-expected pretax loss of EUR 46 million ( USD 64.5 m ) in the fourth quarter of 2009 from a",0
"Result before taxes decreased to nearly EUR 14.5 mn , compared to nearly EUR 20mn in the previous accounting period .",0
The company slipped to an operating loss of EUR 2.6 million from a profit of EUR 1.3 million .,0
23 April 2010 - Finnish construction and engineering company Outotec Oyj HEL : OTE1V said today it slipped to a net loss of EUR7 .3 m in the first quarter of 2010 from a net profit of EUR12 .5 m in the corresponding period last year .,0
Cramo slipped to a pretax loss of EUR 6.7 million from a pretax profit of EUR 58.9 million .,0
"Finnish IT solutions provider Affecto Oyj HEL : AFE1V said today its slipped to a net loss of EUR 115,000 USD 152,000 in the second quarter of 2010 from a profit of EUR 845,000 in the corresponding period a year earlier .",0
"In 2009 , Comptel slipped to a net loss of EUR2 .1 m from a profit of EUR6 .6 m in the previous year .",0
"In Q2 of 2009 , profit before taxes amounted to EUR 13.6 mn , down from EUR 26.8 mn in Q2 of 2008 .",0
"ADPnews - Feb 5 , 2010 - Finnish real estate investor Sponda Oyj HEL : SDA1V said today that it slipped to a net loss of EUR 81.5 million USD 11.8 m in 2009 from a profit of EUR 29.3 million in 2008 .",0
"ADPnews - Jul 17 , 2009 - Finland-based steel maker Rautaruukki Oyj Ruukki HEL : RTRKS said today it slipped to a net loss of EUR 184 million USD 259.7 m for the first half of 2009 from a net profit of EUR 2",0
"Profit before taxes amounted to EUR 56.5 mn , down from EUR 232.9 mn a year ago .",0
"Profit before taxes decreased by 9 % to EUR 187.8 mn in the first nine months of 2008 , compared to EUR 207.1 mn a year earlier .",0
Profit before taxes decreased to EUR 31.6 mn from EUR 50.0 mn the year before .,0
"Profit before taxes was EUR 4.0 mn , down from EUR 4.9 mn .",0
"The company 's profit before taxes fell to EUR 21.1 mn in the third quarter of 2008 , compared to EUR 35.8 mn in the corresponding period in 2007 .",0
Also construction expenses have gone up in Russia .,0
11 August 2010 - Finnish measuring equipment maker Vaisala Oyj HEL : VAIAS said today that its net loss widened to EUR4 .8 m in the first half of 2010 from EUR2 .3 m in the corresponding period a year earlier .,0
"Finnish power supply solutions and systems provider Efore Oyj said its net loss widened to 3.2 mln euro $ 4.2 mln for the first quarter of fiscal 2006-2007 ending October 31 , 2007 from 900,000 euro $ 1.2 mln for the same period of fiscal 2005-06 .",0
"ADP News - Apr 22 , 2009 - Finnish business information systems developer Solteq Oyj HEL : STQ1V said today its net loss widened to EUR 189,000 USD 245,000 for the first quarter of 2009 from EUR 10,000 for the same peri",0
Salonen added that data shows producers ' pulp inventories in North America are declining . ',0
The Elcoteq group recently announced that the last three months of the previous year brought to it a major loss of more than half a billion kroons ( EUR 32 mln ) for the fifth quarter running .,0
Cash Flow from Operations for the most recent quarter also reached a eight year low .,0
RISING costs have forced packaging producer Huhtamaki to axe 90 jobs at its Hampshire manufacturing plant .,0
"`` However , the rapidly increasing costs and the strengthening of the euro were challenging for the whole industry , and they impacted on our results . ''",0
"At this growth rate , paying off the national debt will be extremely painful .",0
Operating loss increased to EUR 17mn from a loss of EUR 10.8 mn in 2005 .,0
"The payment of 2.779 million litas in interest on a long-term loan provided by Ragutis ' majority shareholder , Estonia 's A. Le Coq , also added to the losses .",0
"At the moment , Valio is not worried , but if the ban continues for long , it may become quite a problem .",0
"Finnish Suominen Corporation that makes wet wipes , nonwovens , and flexible packaging is starting employer-employee negotiations at its Tampere plant in Finland to lay off about 25 employees .",0
"According to Arokarhu , some of the purchases that had been scanned into the cash register computer disappeared when the total sum key was pressed .",0
"According to the company , staff will be laid off temporarily when necessary .",0
As a result of the negotiations the employment of 130 blue - and white-collar employees at the Oulu plant would be terminated .,0
"Finnish software and hardware developer Elektrobit Oyj HEL : EBG1V , or EB , said today it will temporarily lay off up to 200 people for a maximum of 90 day in Finland , aiming to achieve cost savings of EUR 1.7 million USD 2m in the second half of 2010 .",0
"On the other hand , Finnish sawmills ' production has decreased even more .",0
"Net sales of Finnish Sanoma Learning & Literature , of Finnish media group Sanoma , decreased by 3.6 % in January-June 2009 totalling EUR 162.8 mn , down from EUR 168.8 mn in the corresponding period in 2008 .",0
"Employing 112 in Finland and 280 abroad , the unit recorded first-quarter 2007 sales of 8.6 mln eur , with an operating loss of 1.6 mln eur .",0
"JP Morgan expects that Scala will lower Nobel Biocare 's growth forecast for 2007 from the current guidance of 23-25 pct , as well as the operating margin target from the current 34-35 pct .",0
"Furthermore , sales of new passenger cars and light commercial vehicles in the country declined by 5.4 % year-on-year last month .",0
"IT services firm TietoEnator was bucking the general trend , holding flat at 22.70 eur , after slipping back from earlier gains .",0
"Profitability ( EBIT % ) was 13.6 % , compared to 14.3 % in Q2 2009 .",0
"Several large stocks tacked lower , however .",0
Sales of mid-strength beer decreased by 40 % .,0
"TeliaSonera 's underlying results however included 457 mln skr in positive one-offs , hence the adjusted underlying EBITDA actually amounts to 7.309 bln skr , clearly below expectations , analysts said .",0
Finnish insurance company Fennia and Kesko Group are ending their loyal customer cooperation .,0
The Finnish daily Kauppalehti surmises that Finnish supplier Rautaruukki has raised its prices above Aker 's comfort zone .,0
"Shares in Royal and Sun Alliance continued to slide back from a 12-month high of 172p last month , after a potential suitor ruled itself out of a takeover bid .",0
"Managing Director 's comments : `` Net sales for the first quarter were notably lower than a year before , especially in Finland , Russia and the Baltic countries .",0
"`` This is super nasty , '' said Eric Schultze , chief technology officer at Shavlik Technologies LLC , a St. Paul , Minn.-based maker of patch management tools .",0
More than a third of the original participants dropped out due to nausea and other side effects .,0
Aspocomp has a large factory in China and a factory building project in India that was halted due to financing problems .,0
F-Secure also point out the logical weakness in the sequenced numbers of a card approach that has apparently already been utilised .,0
The SeaWind that was en route from the Finnish port of Turku to Stockholm got stuck in ice already around 4 p.m. on Wednesday and the Regal Star 's journey from the Swedish port of Kapellskar to Paldiski in northwestern Estonia was cut short at 2 a.m. on Thursday .,0
"`` Uncommonly weak snow conditions in nearly every market have affected our first quarter result , '' Chief Executive Roger Talermo said .",0
Danish company FLSmidth has acknowledged that it has violated a patent held by Finnish Metso .,0
"The liquidity providing was interrupted on May 11 , 2007 when Aspocomp Group Oyj 's shares traded below 0.50 cent ( Aspocomp 's stock exchange release 11.5.2007 ) .",0
"ADP News - Feb 13 , 2009 - Finnish retailer Kesko Oyj HEL : KESBV said today its total sales , excluding value added tax VAT , stood at EUR 661.3 million USD 853.1 m in January 2009 , down 15.2 % year-on-yea",0
The low capacity utilisation rate in steel production considerably increases the fixed costs per unit of steel produced .,0
Asian traffic declined by 3.4 per cent .,0
Finnish plumbing and heating systems supplier Uponor is temporarily laying off its whole workforce in Finland for two weeks as of mid-July 2009 .,0
"In Finland , metal sector company Componenta is laying off temporarily the staff of its Pori mill from Christmas 2008 till 6 January 2009 .",0
"According to Aktia Asset Management , Finnish analysts ' forecasts for 2009 are still too high .",0
"As part of the reorganisation measures that will take place in spring 2006 , Tamglass Finton will start personnel negotiations that will affect its entire staff of 33 .",0
Benefon 's target is to lay off temporarily of permanently up to 20 % of the Salo plant 's staff .,0
Operating cash flow after investments totalled EUR 61.3 mn compared to EUR 75.3 mn in the corresponding period in 2007 .,0
The lay-offs will affect 240 people out of the total 320 Okmetic employees in Finland .,0
The majority of the company 's personnel in Finland is temporarily laid off from one to six weeks in the period from February to June 2009 period .,0
55 workers in +àm+Ñl will be affected by the close-down .,0
Finland-based Stockmann Group has closed seven franchising sports stores Nike in Russia .,0
"In Finland , Sampo Bank , now part of the Danske Bank group , will lay off staff from the administrative and support functions .",0
"Scanfil , a systems supplier and contract manufacturer to the communications sector , will give notice to 20 productional employees , and temporarily lay off 15 employees at the company 's plant in Sievi , in Finland .",0
"Scanfil , a systems supplier and contract manufacturer to the communications sector , will start personnel negotiations in Oulu , in Finland , to lay off staff temporarily .",0
"Additionally , the company will terminate a maximum nine salaried and senior salaried employees ' employment contracts .",0
"Also the city 's insurance company , If P & C Insurance , has said it will not pay compensation .",0
"As a result , the company has decided it will implement fixed-term temporary lay-offs .",0
"As a result , the company will temporarily lay-off 25 % of the whole personnel , approximately 270 persons at Kirkkonummi and Nivala factories .",0
"As a result of the negotiations , the amount of employment contracts to be terminated is 13 .",0
"As a result of the negotiations , the company will terminate total 5 employment contracts .",0
"Due to market conditions , the company will also temporarily lay off about 3,200 people at different sites .",0
GSK announced in November 2008 that it would close its operations in Dartford .,0
"In addition , a further 29 employees can be laid off until further notice and the whole workforce can be laid off for short periods if needed .",0
"Metso Foundries Jyvaskyla , Inc. will begin personnel negotiations on temporary lay-offs and personnel reductions in Jyvaskyla , Finland .",0
"National Conciliator Juhani Salonius , who met both parties on Wednesday , said they were too far apart in their views for him to propose mediation .",0
"Stora Enso Oyj , the largest papermaker , in October said it would close four mills .",0
"Temporary lay-offs , affecting the entire workforce , will also be implemented .",0
"The contracts of the employees , 96 of whom are blue-collar workers , will be ended between March and August 2011 .",0
The current lay-offs are additional to the temporary lay-offs agreed in December 2008 and in May 2009 .,0
"The decision means temporary lay-offs of fixed duration at the company 's Nastola and Jyvaskyla units , in southern and central Finland , respectively .",0
"The negotiation has resulted in the reduction of 80 people in regular employment , around half of which will be covered with pension arrangements .",0
"The number of permanent reductions of clerical workers is 22 employees , of which 19 in Finland .",0
"The personnel reduction will be carried out in Anjalankoski , Hollola , Jyvaskyla , Jarvenpaa , Karhula , Turku and Valkeakoski units .",0
The reduction notice applied to 17 people .,0
18 March 2010 A leakage in the gypsum pond was detected today at the Talvivaara mine .,0
A total of 140 jobs will be reduced at the Raahe Steel Works .,0
As a result some 20 persons will no longer be needed .,0
"Biohit said that it will reduce the number of leased personnel by 10 , and lay off 10 of its own personnel .",0
Finnish sports equipment company Amer Sports said it has decided to lay off 370 workers from its Salomon division in France .,0
"In addition , the company will reduce a maximum of ten jobs .",0
in Finland Finnish pharmaceutical company Orion Corporation OMX Helsinki : ORNAV said on Wednesday 7 January that it has concluded its personnel negotiations in Finland and will reduce the number of personnel by 205 .,0
"Konecranes has previously communicated an estimated reduction of about 1,600 employees on group level in 2009 .",0
"Paper stocks were among the biggest fallers , with Stora Enso down 2.30 pct to 14.01 eur , M-real down 2.86 pct to 5.09 eur and UPM-Kymmene 1.14 pct lower at 19.10 eur .",0
The company decided at the end of 2008 to temporarily shut down its ammonia plant in Billingham and extend the maintenance period at its Ince facility .,0
The employment contracts of 14 of the employees will end in March 2009 as a result of the company 's previous employer-employee talks .,0
"The staff reduction will start immediately , Glaston added .",0
"The total headcount reduction will be 50 persons , the company said .",0
"The workforce will be reduced also in the Amsterdam office , in the Netherlands .",0
The personnel reductions will primarily affect those working for the parent company in the diagnostics business or in production and logistics in the liquid handling business .,0
"In the third quarter of fiscal 2008 Efore swung to a net loss of EUR 400,000 versus a net profit of EUR 200,000 for the corresponding period of fiscal 2007 .",0
"Konecranes Oyj KCR1V FH fell 5.5 percent to 20.51 euros , the biggest fall since June .",0
"Net sales for the financial year 2006 are expected to amount to about EUR20m and the operating result EBIT is expected to be a loss , as announced before .",0
Operating loss totaled EUR 25mn compared to a profit of EUR 63mn in the corresponding period in 2005 .,0
"Production levels have been agreed with producers a long time ago , so a fall in consumption will lead to losses .",0
Return on investment ROI was 4.1 % compared to 43.8 % in the first half of 2008 .,0
"SSH COMMUNICATIONS SECURITY CORP STOCK EXCHANGE RELEASE OCTOBER 14 , 2008 AT 2:45 PM The Company updates its full year outlook and estimates its results to remain at loss for the full year .",0
"The sale will result in a capital loss of EUR5m for Solidium , which obtained Tikkurila shares in March 2010 .",0
- The Group -¦ s result before taxes was EUR -1.9 ( -3.0 ) million .,0
"- The Group 's sales during the period were EUR 37.5 million ( EUR 48.2 million , 1-9/2008 ) and result before taxes was a loss of EUR -3.5 ( +1.2 ) million .",0
"A total of 16.5 mn passenger ship journeys took place in the northern Baltic Sea in 2007 , slightly down from 16.5 mn in 2006 .",0
Finnish media group Talentum has issued a profit warning .,0
"Finnish shipping company Finnlines ' pretax loss totalled EUR 6.5 mn in the third quarter of 2009 , compared to a profit of EUR 0.3 mn in the third quarter of 2008 .",0
"In Finland , the city of Forssa has said it will not pay compensation to food industry companies HK Ruokatalo and Atria for the lye leak into tap water that occurred in March 2008 .",0
"Acando AB ( ACANB SS ) fell 8.9 percent to 13.35 kronor , the lowest close since Dec. 11 .",0
"According to CEO Matti Perkonoja of the parent company HKScan , the company 's performance in the first quarter of 2010 has remained clearly below the level of the corresponding period in 2009 .",0
"Cencorp 's net sales in the first quarter is estimated to be EUR0.9-1 .2 m , as compared to EUR4 .5 m in the first quarter 2008 .",0
Diluted earnings per share ( EPS ) stood at EUR 0.25 versus EUR 0.42 .,0
Earnings per share ( EPS ) amounted to a loss of EUR0 .05 .,0
Earnings per share ( EPS ) amounted to a loss of EUR0 .38 .,0
Earnings per share ( EPS ) amounted to a loss of to EUR0 .06 .,0
Earnings per share were at loss of EUR0 .24 .,0
Expense ratio was 102.6 % compared to 92.9 % in the corresponding period in 2005 .,0
Finnish automation solutions developer Cencorp Corporation ( OMX Helsinki : CNC1V ) issued on Thursday ( 18 September ) a profit warning for the third quarter of 2008 .,0
Finnish communication electronics components supplier Scanfil Oyj Tuesday said sales in the first half of 2006 will be 15 % lower than during the same period a year ago .,0
Finnish forest industry group Stora Enso Oyj issued on Thursday ( 20 March ) a profit warning for the first quarter 2008 .,0
Finnish technology company Raute Corporation ( OMX Helsinki : RUTAV ) issued on Tuesday ( 23 September ) a profit warning for the financial year 2008 .,0
"In Q1 of 2009 , the company 's operating loss totalled EUR 0.3 mn , compared to a profit of EUR 3.6 mn in Q1 of 2008 .",0
"In the reporting period , EPS stood at EUR0 .07 versus EUR0 .11 .",0
"Last year , 8.3 million passengers flew the airline , down 4 percent from 2007 .",0
"Loss after financial items totalled EUR 9.7 mn , compared to a profit of EUR 1.3 mn in the corresponding period in 2008 .",0
Loss for the period totalled EUR 15.6 mn compared to a profit of EUR 6.3 mn in 2008 .,0
"Myllykoski , with one paper plant in Finland , one in the US and three in Germany , had revenues of EUR286m in the first half of 2010 and an operating loss of EUR12m , Reuters said .",0
Nokia Siemens Networks has struggled to make a profit in the past two years .,0
Operating loss amounted to EUR 0.9 mn in the first half of 2006 compared to a profit of EUR 0.5 mn in the first half of 2005 .,0
"Operating loss of the Pulp & Paper Machinery unit was over EUR 3mn in September 2007 - August 2008 , compared to a profit of EUR 3.7 mn a year earlier .",0
Operating loss totaled EUR 0.3 mn compared to a profit of EUR 2.2 mn in the corresponding period in 2007 .,0
"Operating loss totaled EUR 0.8 mn , compared to a profit of EUR 0.5 mn .",0
"Operating loss totalled EUR 12.7 mn , compared to a profit of EUR 17.7 mn in the first half of 2008 .",0
"Operating loss totalled EUR 3.2 mn , compared to a profit of EUR 7.2 mn in the third quarter of 2008 .",0
"Operating loss totalled EUR 4.0 mn , compared to a profit of EUR 8.6 mn in the second quarter of 2008 .",0
"Operating loss totalled EUR 5.2 mn , compared to a loss of EUR 3.4 mn in the corresponding period in 2008-2009 .",0
"Operating profit before non-recurring items was EUR 8.3 mn in the first nine months of 2008 , compared to EUR 8.4 in the corresponding period in 2007 .",0
Pretax loss totaled EUR 117mn compared to a loss of EUR 65mn in the corresponding period .,0
Pretax loss totalled EUR 162.3 mn compared to a profit of EUR 253.5 mn in 2007 .,0
"Pretax loss totalled EUR 49.9 mn , compared to a loss of EUR 15.4 mn in the corresponding period in 2008 .",0
Pretax profit totaled EUR 4.9 mn compared to EUR 5.2 mn in the first quarter of 2005 .,0
"Publishing Sweden 's operating loss was EUR 1.1 mn in Q1 of 2009 , compared to a profit of EUR 0.6 mn a year ago .",0
"Raw materials prices have surged in the past year , fueled in part because of the rapid industrialization of China , India and other developing nations .",0
Rivals say Qualcomm has fewer patents on 3G phones than on earlier versions and should lower its rates .,0
The company reported today an operating loss of EUR0 .1 m on net sales of EUR4 .5 m for the first quarter 2008 .,0
"The company 's annual loss amounted to EEK 18mn , compared to a profit of EEK 7.3 mn in 2008 .",0
"The fair value change of investment properties was EUR 15.8 mn , compared to EUR 22.9 mn in the third quarter of 2009 .",0
The stock was hit by the profit warning of Finnish rival Rautaruukki Oyj ( OMX : RTRKS ) .,0
Finnish Bank of +àland +àlandsbanken has issued a profit warning .,0
Finnish forest machinery manufacturer Ponsse has issued a profit warning .,0
"Cerberus Capital Management LP-backed printing paper maker NewPage Corp. has posted mixed second-quarter results , casting a cloud over its planned initial public offering .",0
"Finnish electronics manufacturing services EMS company Elcoteq SE posted a net loss of 66.4 mln euro $ 91.2 mln for the first half of 2007 , compared to a net profit of 7.1 mln euro $ 9.8 mln for the same period of 2006 .",0
Finnish laboratory liquid handling and diagnostic test systems developer Biohit Oyj OMX Helsinki : BIOBV issued on Tuesday 3 June a profit warning for the financial year 2008 .,0
Finnish retail software developer Aldata Solution Oyj reported a net loss of 11.7 mln euro $ 17.2 mln for 2007 versus a net profit of 2.5 mln euro $ 3.7 mln for 2006 .,0
"Finnish textiles and clothing group Marimekko Oyj posted a net profit of 7.99 mln euro $ 10.4 mln for 2006 , compared to 8.4 mln euro $ 10.9 mln for 2005 .",0
"In 2009 , Stora Enso 's net loss was EUR 879.7 million compared to EUR 673.4 million in the previous year .",0
"In January-June 2010 , diluted loss per share stood at EUR0 .3 versus EUR0 .1 in the first half of 2009 .",0
"In October , UPM reported a third-quarter net loss of euro86 million $ 110 million compared with a net profit of euro120 million in 2007 .",0
Operating loss amounted to EUR 0.7 mn compared to a profit of EUR 0.8 mn in the second quarter of 2005 .,0
"Operating loss before non-recurring items was EUR 0.9 mn , compared to a profit of EUR 11.5 mn in 2008 .",0
"Operating profit margin was 8.3 % , compared to 11.8 % a year earlier .",0
Operating profit was EUR 1.6 mn in 2005 compared to EUR 5.9 mn in 2004 .,0
"Operating result showed a loss of EUR 2.9 mn , while a year before , it showed a profit of EUR 0.6 mn .",0
Performance in 2006 was impacted by the consolidation trend in the telecom sector and the overall and structural changes in the contract manufacturing market in telecommunications technology and industrial electronics .,0
"Salcomp Oyj , the Finnish maker of mobile phone chargers , Monday posted a EUR1 .49 million loss in the second quarter compared with a 1.70 million profit in the same period the previous year .",0
Scanfil has also issued a profit warning .,0
Scanfil issued a profit warning on 10 April 2006 .,0
"The operating loss amounted to EUR 0.8 mn , compared to a profit of EUR 3.9 mn a year earlier .",0
"The period-end cash and cash equivalents totaled EUR6 .5 m , compared to EUR10 .5 m in the previous year .",0
"The poorest index figure was given to Finnish power company Fortum , 4.5 .",0
The real estate company posted a net loss of +ó  x201a -¼ 59.3 million +ó  x201a -¼ 0.21 per share compared with a net profit of +ó  x201a -¼ 31 million +ó  x201a -¼ 0.11 per share for the corresponding quarter of 2007 .,0
"The tightened competition situation in the production automation market has affected net sales during 2006 , Cencorp said .",0
"TietoEnator was down 1.13 pct to 18.38 , extending recent lows after last week 's second-quarter report , dealers said .",0
"So far Norwegian Norske Skog has reduced the staff levels by 1,000 people and plans to reduce production by 200,000 tons in 2008 , while Finnish-Swedish Stora Enso is to cut staff by 1,700 people and production by 500,000 tons .",0
25 March 2011 - Finnish electronics contract manufacturer Scanfil Oyj HEL : SCF1V said today its plan to merge wholly owned Scanfil EMS Group with Ojala-Yhtyma Oy has hit a snag as shareholders of the domestic rival rejected the deal .,0
Elisa CEO Sami Seppanen said EMT 's slogan `` Best coverage across Estonia '' clearly gives misleading information to consumers .,0
"In this case , the effect would be negative in Finland .",0
Nokia will certainly disagree with Qualcomm 's views on the patent situation .,0
"Outokumpu 's steel mill in Tornio , in Finland , is the suspected source .",0
