Texts,Sentiment
"The tests , conducted at Nokia Siemens ' LTE center of competence in Espoo , Finland , follow the company 's production start of LTE-ready Flexi Multiradio Base Stations for the 800 MHz band in April 2010 , and complement earlier tests with Nokia on the 2100 MHz and 2600 MHz bands .",1
The tool is a patent pending design that allows consumers to lay out their entire project on a removable plate using multiple clear stamps of any kind .,1
The use case dramatically narrows if you go only with the hot s Ltd.,1
"The vessels also have to be environmentally friendly , fast , and have all modern conveniences .",1
"Thus , SysOpen Digia has , in accordance with Chapter 14 Section 21 of the Finnish Companies Act 29.9.1978 - 734 , obtained title to all the shares of Sentera that are to be redeemed .",1
Today the orange scissors are the iconic symbol of the excellent ergonomic design and superior quality associated with every product from Fiskars .,1
"We have sound experience of project deliveries for large multi-purpose complexes and sports arenas '' , says Sami Eronen , SVP , Infrastructure and Northern Europe , Ruukki Construction .",1
"Weber convinced his friend Ray Ostrom , who owned a Lake Street sporting goods store , to sell the lures .",1
"Marimekko makes all sorts of colorful little impulse buys `` umbrellas , baby bibs , change purses `` and they 're all for sale , the better to take advantage of shoppers who ca n't commit to furniture but want a piece of the action .",1
"Swedish telco TeliaSonera is teaming up with Friends , a Swedish organization against bullying , to fight bullying of children and teenagers via electronic channels .",1
"`` Each year , personal entertainment plays a more significant role in determining whether a fitness facility 's workout experience is pleasurable or a chore , '' said Brian Wilson , director of marketing for Precor 's Entertainment & Services Division .",1
`` I see my new post as an inspiring challenge .,1
"`` We will continue to make it easier for users to explore services on their handsets and will work towards bringing Internet to a wider range of devices including mid and low-end devices , '' said Kallasvuo .",1
Finland 's dominating rail company VR is planning to set the infected passengers for long-distance trip in a separate carriage .,1
Our purchase to pay solutions enable companies to gain visibility and control over business-critical financial processes .,1
The agreement must be approved by the Russian competition authorities before it enters into force .,1
The total amount of subscription prices was recorded in the fund for invested non-restricted equity .,1
"Before Kemira 's installation NordAlu was producing 3,500 tons of liquid and solid aluminum waste per year .",1
"He announced a `` solutions unit '' to speed co-operation in August , and shifted Simonson from finance chief to low-end phones in October .",1
"It started with software that was capable of retrieving the data typed into the computer keyboard ( `` keyloggers '' ) , and then more complex mechanisms arrived on the scene , such as phishing and pharming .",1
Mr Skogster currently serves as the manager responsible for ABB Oy 's system modules for low voltage drives .,1
"The Finnish company sold its UK operation - consisting of 50 staff in offices in London , Birmingham and Manchester - as part of a deal with Hampden in July 2001 for its European-wide property and casualty arm Sampo Industrial .",1
- Counter your competitor 's strengths and target their weaknesses .,1
An appeal concerning the project has been lodged at the Czech Ministry of the Environment .,1
"Founded in 2000 , BioView automates laboratory tests , especially diagnostic tests for cancer .",1
It inspects the companys strategic strengths and weaknesses .,1
"It 's even a little bit higher than Yara 's multiples on itself , ' an analyst in Helsinki said .",1
"Kesko offers Hilton to open a hotel on Kalinisky prospect in a 18,000-square metres building because of these difficulties .",1
"Key reasons to read this report : - Report contains only relevant information , leaving out excessive data .",1
"The dollar bounced back after hitting another record low against the euro , which reached $ 1.41 for the first time .",1
"The five-storey , eco-efficient building will have a gross floor area of about 15,000 sq m. It will also include apartments .",1
"The new company will buy from Baltic Pearl CJSC a lease right to 8.1 hectares for the construction of a mall with a gross area of 140,000 sq m 1.5 million sq ft .",1
"The Stena Poseidon is a so-called Panamax tanker , designed to be able to pass through the narrow passages in the Panama Canal 's locks .",1
"As a result of the cancellation , the maximum increase of Citycon 's share capital on the basis of the convertible bonds decreased from EUR 23,383,927.80 to EUR 22,901,784.75 .",1
Aspo 's net sales in 2006 totaled EUR 225.9 million .,1
Both companies ' existing investment plans will be coordinated .,1
E 's building system service had revenue of EUR 355 mln in 2007 .,1
Export accounts for about one tenth of the company 's annual turnover of one billion kroons .,1
"For 2009 , Incap expects revenue of some EUR 70 million .",1
"In 2006 the company 's net sales amounted to approximately EUR259m and it has some 8,000 employees .",1
"In 2009 , KONE had annual net sales of EUR 4.7 billion and approximately 34,000 employees .",1
"In the second quarter of 2009 , net sales through operator business partners represented 47 % of the Group 's total net sales .",1
International operations accounted for over 80 % of net sales .,1
"Latin America currently accounts for approximately 40 % of sales at Finnish BSS-OSS and VAS supplier for telecoms operators Tecnotree , company president and CEO Eero Mertano told BNamericas .",1
"Net sales in 2010 were about EUR 2.0 billion , of which international operations accounted for roughly a quarter .",1
"Nokia OYJ 's production site at Bochum , Germany , posted profit before interest of 134 mln eur for 2007 , Capital reported in an excerpt of an article to be released tomorrow , citing internal documents .",1
"Operating income was EUR -24.9 mn , including EUR 15.3 mn of restructuring expenses .",1
Operating profit for the quarter April-June 2006 amounted to EUR42 .9 m on net sales of EUR156 .3 m.,1
Poyry 's net sales in 2007 amounted to about EUR 720 million and it employs 7400 experts .,1
Roshan 's net sales in 2006 were $ 191 million and EBITDA was $ 66.5 million .,1
"The Board of Directors proposes to the Shareholders ' Meeting on 18 March 2010 that the company would pay dividend for the financial year January 1 - December 31 , 2009 , EUR 0.02 per share .",1
"The company , employing 6,400 , reported net sales of 620 mln euro $ 823.2 mln for 2006 .",1
"The company reported net sales of EUR550m in 2005 and had some 3,200 employees .",1
The company 's net sales in 2010 totalled MEUR 311.4 with an operating margin of 13.9 per cent .,1
"The company will pay a dividend of EUR 0.50 per share , a total of EUR 14mn .",1
"The decision of Tekes was based on , among other , the following grounds : the project has a significant impact on the business development of the company .",1
"The estimated turnover of the new company is LVL 2,5 million EEK 40 million .",1
The Finnish company claims to have over a quarter of a million contented Tulikivi fireplace business and homeowners worldwide .,1
The four-year contract between the bank and Ski Sport Finland will bring the bank 's advertisements to skiers helmets and caps .,1
"The Group , with net sales of EUR 235 million in 2009 , employs more than 2 000 people in 33 countries .",1
The group had an order book of EUR 7.74 mn at the end of 2007 .,1
"The report also said Nokia 's operations comprising the sites at Bochum , Ulm , Dusseldorf , Munich and Frankfurt posted operating profit after interest of 246 mln eur .",1
The value of orders on hand totaled EUR 237.1 mn .,1
The value of the confirmed aircraft orders totals EUR 2bn .,1
"`` In Ukraine , too , we act as a partner for major bakery clients in both production and product development .",1
`` They 've already allocated money for the inventory .,1
Finnish navigation device manufacturer Benefon that is changing its name to GeoSentric reports net sales of about EUR 1.1 mn in the second quarter of 2007 .,1
The order for plywood mill machinery and equipment announced by Finnish Raute in September 2006 will be delivered to Thebault Plyland in France .,1
"According to Scanfil 's President Harri Takanen , Scanfil 's investment activity proceeded according to the strategy on several fronts in 2010 .",1
Alma Media 's net sales in 2009 totalled MEUR 307.8 with an operating margin of 13.5 per cent .,1
Aspokem posted an operating profit of 2.7 mln euro ( $ 3.5 mln ) and net sales of 89.1 mln euro ( $ 116.8 mln ) in 2006 .,1
"Auburn 's sales in 2007 were CAD 41 million ( approximately EUR 27 million ) , and the company employs some 150 people .",1
"Cargotec 's sales totalled EUR 3.4 billion in 2008 and it employs approximately 10,500 people .",1
CORPORATE IT UPDATE - ( C ) 1995-2009 M2 COMMUNICATIONS LTD Finnish technology group Teleste Corporation ( OMX Helsinki : TLT1V ) reported on Wednesday ( 4 February ) an operating profit of EUR5 .6 m on net sales of EUR108 .7 m for the year 2008 .,1
Cymed 's net sales are expected to amount to EUR 3.5 mn in 2006 .,1
Delhaize Le Lion has selected the Aldata G.O.L.D. Vocal PDA solution on the Motorola WT4090 PDA terminal .,1
Elcoteq 's revenues in 2007 were approximately EUR 120 million .,1
Finland-based international machinery rental company Ramirent Plc ( OMX Helsinki : RMR1V ) reported on Friday ( 15 August ) an operating profit of EUR65 .0 m on net sales of EUR342 .9 m for the period January-June 2008 .,1
Finnish aluminium products manufacturer Nordic Aluminium Plc ( OMX Helsinki : NOA1V ) reported on Monday ( 18 August ) an operating profit of EUR7 .9 m on net sales of EUR55 .2 m for the period January-June 2008 .,1
Finnish component supplier Componenta Corporation ( OMX Helsinki : CTH1V ) reported on Tuesday ( 15 July ) an operating profit of EUR46 .2 m on net sales of EUR386 .0 m for the financial period January-June 2008 .,1
Finnish glass technology group Glaston Corporation ( OMX Helsinki : GLA1V ) reported on Thursday ( 14 August ) an operating profit of EUR6 .5 m on net sales of EUR201 .5 m for the period January-September 2008 .,1
Finnish logistics and information solutions provider Done Solutions Corporation ( OMX Helsinki : DSO1V ) reported on Wednesday ( 29 October ) an operating profit of EUR3 .6 m on net sales of EUR35 .1 m for the period January-September 2008 .,1
"Finnish software company QPR Software Plc ( OMX Helsinki : QPR1V ) reported on Thursday ( 23 October ) an operating profit of EUR63 ,000 on net sales of EUR1 .5 m for the third quarter 2008 .",1
"Following the payment made in April , the company has a total of EUR 23.0 million in loans from financial institutions .",1
"For the fiscal year ending September 30 , 2009 the revenue from these customers was $ 10.012 million or around 11.0 % of the transportation group 's revenue .",1
"Galeria Podlaska , a shopping mall on Wysockiego Street in Bia ` ystok , is approximately 60-percent leased or reserved .",1
In 2005 the bank posted a net profit of Lt 8.2 mn .,1
"In 2006 , TeliaSonera net sales were SEK 91 bn , EBITDA was SEK 32.266 bn , net income was SEK 19.28 bn .",1
"In 2007 , Alma Media 's operating profit was about EUR 53mn .",1
"In 2007 , almost two thirds of Orion 's net sales came from these drugs .",1
"In 2007 , Huhtamaki will continue to invest in organic growth .",1
"In 2007 , the Group 's net sales stood at EUR 22 million and it had about 150 employees at the end of June , 2008 .",1
"In 2009 , it reported net sales of approximately EUR 6mn .",1
"In 2010 , the Marimekko Group s net sales were EUR 73,297 thousand ( EUR 72,473 thousand ) and operating profit was EUR 8,169 thousand ( EUR 6,291 thousand ) .",1
"In beers , Olvi retained its market position .",1
"In January-September 2007 , operating profit totaled EUR 20.5 mn .",1
It appears from statistics of the Technical Surveillance Authority that customers who switch service providers mostly transfer their numbers to Elisa 's network .,1
"It expects revenue between $ 8.4 billion and $ 8.7 billion , compared to analyst estimates of $ 8.67 billion .",1
"Kemira will supply the additional volumes of iron coagulants from the company 's plant at Helsingborg , Sweden .",1
"Metso will provide a recovery boiler with a capacity of 6,800 tonnes of dry solids per day and an evaporation plant with six thermal stages and a capacity of 1,600 tonnes per hour .",1
Net profit in the period in 2009 was ( EURO ) 29 million .,1
Net profit in the same period in 2006 was 36.6 million euros .,1
Net profit in the same period in 2006 was (  x20ac ) 172 million .,1
Net sales are expected to remain on the same level as in 2007 .,1
"Net sales by the Sata-Flexo Group came to some EUR4 .3 m in 2007 , and the group companies employed a total of 40 people .",1
Net sales in 2006 totaled EUR 302 million and the operating margin was 16 % .,1
Net sales in 2007 totalled EUR 329 million and the operating margin was over 19 % .,1
Net sales in 2008 are expected to be on the same level as in 2007 .,1
Net sales of the Lehdentekijat unit was approximately EUR 14 million in 2007 and it had 70 employees .,1
Nokia Corp of Finland Tuesday said it has received a unified device managment contract with Finnish operator Elisa Oyj .,1
Nokia has enough users to do just as well .,1
"Of this , EUR 38.8 mn was net interest income .",1
"OMEO ( www.omeo.se ) employs 55 and expects net sales of some 23 mln euro ( $ 29.8 mln ) for fiscal 2006-2007 , ending April 30 , 2007 .",1
Operating profit for the quarter April-June 2006 amounted to EUR182 .2 m on sales of EUR3 .62 bn .,1
Operating profit totaled EUR 18.6 mn or 8.3 % of net sales .,1
"Previously , Vaahto Pulp has supplied headboxes with rectifier roll and dilution control technology for Stora Enso 's mill in Imatra , eastern Finland .",1
Profit of the accounting period was EUR 0.3 mn .,1
"Russia accounted for 9 % of the Lagardere magazine division 's revenue , or EUR 114.40 mn ( USD 148.11 mn ) in 2009 , the USA - for 18 % .",1
Scanfil expects net sales in 2008 to remain at the 2007 level .,1
"So , at the present time Nokian tires had the contract of tires production in China .",1
"Solvay S.A. has engaged Poyry to provide project management , engineering , procurement , and site services for a hydrogen peroxide production plant to be built by a Solvay-BASF joint venture at BASF 's Zandvliet site , Belgium .",1
Tekla Group 's net sales for 2005 were approximately 38 million euros .,1
"The agreement , which will cover monitoring , maintenance , server capacity service and backups , has a one-year extension option .",1
The amendment will not incur additional costs .,1
The company also said that its board of directors has proposed a profit distribution of EUR0 .92 per share .,1
The company closed last year with a turnover of about four million euros .,1
The company expects net sales of 65 mln euro ( $ 85.1 mln ) for 2006 .,1
The company expects sales revenue of RMB8 .0 billion in 2009 .,1
The company has exported into about twenty European countries as well as to Africa .,1
The company 's net sales in 2009 totalled MEUR 307.8 with an operating margin of 13.5 per cent .,1
The company 's operating profit for 2006 stood at 39.6 mln euro ( $ 57.9 mln ) .,1
"The company 's profit totaled Ls 134,700 .",1
"The company targets sales of Ls 27.1 mn ( Ls 23.498 mn ) and a profit of Ls 300,000 ( Ls 371,500 ) in 2007 .",1
The company will build altogether 130 new substations by the end of this year .,1
The earnings in the comparative period included a capital gain of EUR 8mn from the sale of OMX shares .,1
The Finnish textiles and clothing company Marimekko Corporation ( OMX Helsinki : MMO1V ) reported on Wednesday ( 5 November ) an operating profit of EUR8 .1 m on net sales of EUR59m for the period from January to September 2008 .,1
The first quarter was as expected and was in line with analysts ' forecasts .,1
The German subsidiary will produce software development services for Ixonos Telecommunications Business Unit 's client projects .,1
"The Group 's consolidated net sales for 2008 totaled 3.4 billion euros and it employs approximately 13,000 persons .",1
"The Group 's consolidated net sales for 2009 totaled 1.5 billion euros and it employs approximately 10,000 persons .",1
"The Group 's revenue amounts to over EUR 80 million , about half of which is accounted for by exports .",1
The Group 's revenue in 2008 amounted to EUR 94 million and the company currently employs approximately 730 people .,1
The Group 's revenue in 2009 amounted to EUR 70 million and the company currently employs approximately 780 people .,1
The insurance division turned a EUR120m profit .,1
The opening of the portal is part of the expansion strategy of Alma Media 's Marketplaces business unit .,1
"The segment has an annual revenue of approximately EUR400m , the company said .",1
The solvency capital ratio of both companies was 2.7 times the solvency limit .,1
"Under the agreement , Japrotek will deliver nine storage tanks in the volume range of 1,000 cu m to 3,000 cu m with included agitators .",1
Under the agreement Ponsse will provide forest machine maintenance services to Stora Enso 's Russian wood procurement operations .,1
Under the terms of this agreement Lextel Group has committed to an opening order of EUR3 .75 m for Benefon mobile units to be co-branded with Capitel for the China market .,1
Vacon 's office will support its customers in Brazil and South America .,1
"With the second phase of the new Innova building , Tecnopolis presence in Jyvaskyla will increase to a total of approximately 62,000 floor square meters .",1
- Moody 's said it gave P A1 long-term senior unsecured and P P-1 short-term debt ratings to Finnish lender Aktia Bank 's EUR1bn USD1 .4 bn euro medium-term note EMTN program of 25 March 2011 .,1
Finnish construction company Lemminkainen Oyj HEL : LEM1S said yesterday that it would build a plastic film extrusion plant for packaging materials supplier Ab Rani Plast Oy at Lemminkainen 's Kaluga industrial park in Russia .,1
Glaston also has efficiency measures in all other units .,1
"Nokia will deliver a WCDMA 3G-HSPA radio network , including the modular , high capacity Nokia Flexi WCDMA base station to Indosat .",1
"The contract traded at an all-time high of $ 50,200 a ton on April 24 .",1
The impact of this acquisition to Teleste 's net sales for 2010 is estimated to be approximately EUR 2 million .,1
The impact on TietoEnator 's net sales for 2008 from the purchase is expected to be some 11 mln euro $ 15.9 mln .,1
These savings will have full impact as of the beginning of 2007 .,1
"Together , Yahoo and Nokia said they will continue to deliver Internet experiences that address the core needs of consumers , developers , operators and advertisers .",1
"- Inge Larsen (CFO), 29,045 shares , representing 0.50 % of the share capital .",1
The forecast for 2012 is 3.3 % .,1
"The share capital of Alma Media Corporation (business ID 1944757-4)is EUR 45,031,513.80 and it is divided into 75,052,523 shares .",1
The company is listed on the Nordic Exchange in Helsinki .,1
"Incap Contract Manufacturing will carry out the manufacturing for these agreements at its factory in Tumkur , near Bangalore .",1
"It will be operated by Nokia , and supported by its Nokia NetAct network and service management system .",1
28 January 2011 - Finnish technology center operator Technopolis Oyj (HEL : TPS1V)said today it will invest EUR22 .5 m in the construction of the second phase of an office facility in Tampere .,1
Comptel Corporation will publish its financial statements for 2008 on 12 February 2009 .,1
"Finnish L&T Recoil , a company specialising in used oil regeneration , is building a facility in Hamina in Finland in 2008 .",1
The shops are located in the capital region and the Paijat-Hame region .,1
The carrier said its Area travel agency is to sell most of its outlets to sister chain Suomen Matkatoimisto (SMT)and use its remaining bricks-and-mortar presence to primarily target business customers going forward .,1
The annual net sales of the unit is some EUR 5 million and it currently employs some 55 people .,1
"On the following workday customers can check from their home computers how their purchases are divided between different ingredient groups , how much energy various products contain and what is the nutritional content of all purchases .",1
Name of Company in which holdings have been acquired : Citycon Oyj 2 .,1
"BasWare is headquartered in Espoo , Finland .",1
"The store is located in Poznan in a shopping center named Pestka , the company added .",1
"The other seats would go to Edgar Edmonds , an American with experience of the clothing and retail industry , and Christian Fischer , an Austrian with experience in the winter sports goods business .",1
"According to the Act , universities can now acquire private funding .",1
"Following its strategy , Tikkurila has established a fully-owned sales company TOO Tikkurila in Almaty , Kazakhstan , for marketing decorative paints under the Finnish Tikkurila brand and the Russian Teks brand .",1
"Ahlstrom 's 5,700 employees serve customers via sales offices and production facilities in more than 20 countries on six continents .",1
"Raute , headquartered in Nastola , Finland , is a technology company serving the wood products industry worldwide .",1
"According to latest information , Benefon will launch its Twig device on 20 September 2006 .",1
Atria will also buy the shares of Kauhajoen Teurastamokiinteistot Oy (Kauhajoki slaughterhouse property)from Itikka Co-operative .,1
"The joint venture will invest about EUR 500,000 in production technology straight away .",1
He will report to CapMan Plc 's CEO Heikki Westerlund .,1
The price will be specified at the completion date .,1
A total of $ 78 million will be invested in the project .,1
"Finnish IT consultancy Satama Interactive Oyj said on November 13 , 2006 that Jarmo Lonnfors took up the position of CEO .",1
"H1 '08 H1 '07 Q2 '08 Q2 '07 in mln euro , unless otherwise stated Net sales 386 328.6 201 160.7 Operating profit 46.3 35.8 23.2 9.5 Pre-tax profit 33.6 26.9 18.7 5.1 Net profit 25.1 25.4 14 4.0 EPS in euro 2.20 2.36 1.24 0.38 1.0 euro = $ 1.60 www.componenta.com",1
"` Nordea 's definitely too big for Sampo to acquire , ' said an analyst ` But Sampo would appear to have an agenda for Nordea ahead of the privatisation .",1
`` Fixed Mobile Convergence solutions represent a key value proposition in today 's communication market .,1
`` There is no room to modify the share component as we have already indicated . '',1
`` We could be there .,1
"1 p.m. Central office of Nordea Bank 19 3-ya ulitsa Yamskogo Polya , Building 1 Telephone : 495 777-34-77 ext. 3932 , 3931 03.02.2011 Unimilk - EGM 03-04 .02.2011 XVI international business-summit Food Business Russia 2011 will take place .",1
"128,538 shares can still be subscribed for with Series E share options , max .",1
15 November 2010 - Finnish energy company Fortum Oyj HEL : FUM1V said today it and partners started negotiations to establish a new operating model for energy supply in the Turku region of western Finland .,1
"561,470 new shares under 2003 option rights plan Packaging company Huhtamaki Oyj reported on Monday that a total of 561,470 new shares of the company have been issued based on share subscriptions under its 2003 option rights plan .",1
"A meeting for the media and analysts will be held on the same day at 10:30 a.m. at Stonesoft Headquarters in Helsinki , Italahdenkatu 22 A. The Interim report will be presented by Stonesoft 's CEO Ilkka Hiidenheimo .",1
A meeting of Glisten shareholders to vote on the bid will be held on 12 March .,1
"A replay will be available until 27 October 2006 in the following numbers : US callers : +1 617-á801-á6888 , non-US callers : +44 20 7365 8427 , access code : 2659 5401 .",1
"A spokesman said : `` The food store center , subject to council and local support , could comprise a supermarket or smaller store and other niche outlets , and this will be firmed up following consultation with the council and local community regarding appropriate uses and occupiers . ''",1
"A total of 185 Wonderware Certified SIs are available to integrate and support Wonderware products such as InTouch -« HMI software , IndustrialSQL Server historian , Wonderware Information Server , DT Analyst software or QI Analyst SPC software .",1
A. Le Coq had a market share of 41.3 percent and rival beverage group Saku 32.1 percent .,1
"About 36 % of this came from Aspo Chemicals , 39 % from Aspo Shipping and 25 % from Aspo Systems .",1
"About 72 % of Evraz Group shares are owned by Lanebrook , whose beneficiaries , on the one hand , are Millhouse , the holding company for the assets of billionaire Roman Abramovich and his business partners 50 % ; and Evraz executives Alexander Abramov and Alexander Frolov 50 % , on the other .",1
Absolut Bank is exploring the possibility of further borrowing .,1
Aker Yards Finland will begin using Chinese subcontractors at its Finnish shipyards .,1
Finnish food industry company L+ñnnen Tehtaat is planning changes to its fish product business .,1
Finnish property investment company Citycon plans to issue directed subordinated convertible bonds to institutional investors .,1
