Texts,Sentiment
"Operating profit decreased to nearly EUR 1.7 mn , however .",0
Operating profit fell to EUR 20.3 mn from EUR 74.2 mn in the second quarter of 2008 .,0
Operating profit in the fourth quarter fell to EUR33m from EUR39m a year earlier .,0
"Operating profit totaled EUR 3.8 mn , down from EUR 4.5 mn in the corresponding period in 2005 .",0
"Operating profit totaled EUR 6.7 mn , down from EUR 7.2 mn in the corresponding period in 2005 .",0
"Operating profit totaled EUR 9.4 mn , down from EUR 11.7 mn in 2004 .",0
"Operating profit totalled EUR 1.22 mn , down from EUR 3.56 mn in the first quarter of 2008 .",0
"Operating profit totalled EUR 30.2 mn , down from EUR 43.8 mn a year earlier .",0
"Operating profit totalled EUR 9.0 mn , down from EUR 9.7 mn in the first half of 2008 .",0
"Operating profit totalled EUR 9.6 mn , down from EUR 42.0 mn the year before .",0
"Operating profit was EUR -0.1 mn , down from EUR 1.3 mn .",0
"Profit for the period was EUR 10.9 mn , down from EUR 14.3 mn in 2009 .",0
"Revenue was slightly down , at  x20ac 495 million $ 634 million , compared to  x20ac 497 million a year earlier .",0
Sales by Seppala diminished by 6 per cent .,0
Talentum 's net sales in September were smaller than expected .,0
"The company 's profit totaled Ls 578,100 in H1 2007 , down 30.9 % year-on-year .",0
The company said that sales in the three months to the end of March slid to EUR86 .4 m US$ 113.4 m from EUR91 .2 m last year .,0
The operating margin came down to 2.4 % from 5.7 % .,0
The operating margin of Aker Yards Cruise & Ferries division went down from 8.3 % to 6.4 % in the first quarter of 2007 .,0
The total capital of funds managed by the bank decreased by 28 % to EUR 284mn by the end of September 2008 .,0
UPM stock fell 3 percent to EURO 12.49 $ 17.24 in early afternoon trading in Helsinki .,0
"YIT 's Baltic sales in the first three quarters of 2008 totaled 106.2 million euros , representing a drop of 29 percent year on year .",0
"- Demand for fireplace products was lower than expected , especially in Germany .",0
"However , the orders received during the period under review fell by 17 % quarter-on-quarter from the EUR 213 million recorded in the second quarter of 2010 .",0
"The announcement pushed Freenet shares down 6.3 % , or EUR0 .71 , in Frankfurt trade to EUR10 .65 as investors gave up hope United Internet AG and Drillisch would pursue their own takeover and breakup of Freenet .",0
"According to the company , in addition to normal seasonal fluctuation the market situation has weakened during autumn 2008 .",0
"Changes in the market situation and tougher price competition have substantially reduced demand for bread packaging manufactured at the Kauhava plant , according to the company .",0
"In the building and home improvement trade , sales decreased by 6.3 % , totalling EUR 154.1 mn .",0
"In the building and home improvement trade , net sales totalled EUR 1,173 mn , down from EUR 1,566 mn a year earlier .",0
"In the building and home improvement trade , sales decreased by 22.5 % to EUR 201.4 mn .",0
"Finnish Suominen Corporation that makes wipes , nonwovens , and flexible packaging , expects changes in the market situation to reduce sales of Suominen 's nonwovens and wet wipes from the previously estimated volumes .",0
The net sales of the whole fiscal year 2008 will be lower than in 2007 and operating profit is estimated to be negative .,0
Sales at the unit slumped last year after the industry was hit by poor snowfall in the major resorts in the winter of 2006-07 .,0
"The steelmaker said that the drop in profit was explained by the continuing economic uncertainty , mixed with the current drought in bank lending , resulting in a decline in demand for its products as customers find it increasingly difficult to fund operations .",0
"UPM-Kymmene Corp. , the world 's largest maker of magazine paper , on Tuesday reported a 19-percent profit drop as lower paper prices , higher costs and a strong euro hurt revenue .",0
Finnish meat company Atria can no longer promise a sufficient amount of domestic beef to its customers .,0
`` Capital expenditure on energy efficiency has unfortunately fallen along with the decline in the economy .,0
"Due to the rapid decrease in net sales , personnel reductions have been carried out on a wider scale than initially expected .",0
Finnish waste management and cleaning group Lassila & Tikanoja Oyj ( L&T ) net profit went down to 32.2 mln euro ( $ 47.7 mln ) for 2007 from 35.3 mln euro ( $ 52.3 mln ) for 2006 .,0
"Qualcomm estimated a first-quarter profit between 46 and 50 cents a share , excluding certain items , below the analyst estimate of 61 cents a share .",0
"Operating margin , however , slipped to 14.4 % from 15.1 % , dragged down by a poor performance in enterprise solutions .",0
"External net sales from the printing business fell by 43.7 % , partly due to the termination of the printing contract between Ilkka-Yhtyma 's printing house I-print Oy and sector player HSS Media AB in December 2009 and the fall in printing prices .",0
"Seven-month sales of Ragutis , which is controlled by the Finnish brewery Olvi , declined by 11.2 percent , to 15.41 million liters , and the company held 9.89 percent of the market .",0
"The OMX Helsinki index was down 0.34 pct at 8,256.02 on turnover of 813.191 mln eur .",0
Repeats sees 2008 operating profit down y-y ( Reporting by Helsinki Newsroom ) Keywords : TECNOMEN-RESULTS,0
"Comparable operating profit totaled EUR 4.7 mn , down from EUR 5.1 mn in the corresponding period in 2005 , representing 7.4 % of net sales .",0
"In Finland 's Hobby Hall 's sales decreased by 10 % , and international sales fell by 19 % .",0
"In the Baltic states the company reports net sales of EUR 11.9 mn , down from EUR 14.2 mn , and an operative EBIT of EUR -2.2 mn , down from EUR -1.7 mn .",0
"Operating profits in the half were  0.8 m , down from  0.9 m as Glisten invested in the brand and the management team .",0
"Sales in Finland decreased by 2.0 % , and international sales decreased by 9.3 % in terms of euros , and by 15.1 % in terms of local currencies .",0
"Operating result for the 12-month period decreased from the profit of EUR0 .4 m while turnover decreased from EUR5 .6 m , as compared to 2004 .",0
"HELSINKI Thomson Financial - Shares in Cargotec fell sharply in early afternoon trade after the cargo handling group posted a surprise drop in April-June profits , which overshadowed the large number of new orders received during the three months .",0
LONDON MarketWatch -- Share prices ended lower in London Monday as a rebound in bank stocks failed to offset broader weakness for the FTSE 100 .,0
"Operating profit fell to EUR 35.4 mn from EUR 68.8 mn in 2007 , including vessel sales gain of EUR 12.3 mn .",0
"Sales in Finland decreased by 10.5 % in January , while sales outside Finland dropped by 17 % .",0
"According to Gran , the company has no plans to move all production to Russia , although that is where the company is growing .",1
"Technopolis plans to develop in stages an area of no less than 100,000 square meters in order to host companies working in computer technologies and telecommunications , the statement said .",1
"At the request of Finnish media company Alma Media 's newspapers , research manager Jari Kaivo-oja at the Finland Futures Research Centre at the Turku School of Economics has drawn up a future scenario for Finland 's national economy by using a model developed by the University of Denver .",1
"In Sweden , Gallerix accumulated SEK denominated sales were down 1 % and EUR denominated sales were up 11 % .",1
The company supports its global customers in developing new technologies and offers a fast route from product development to applications and volume production .,1
"When this investment is in place , Atria plans to expand into the Moscow market .",1
"`` The new agreement is a continuation to theagreement signed earlier this year with the Lemminkainen Group , whereby Cramo acquired the entire construction machine fleet ofLemminkainen Talo Oy Ita - ja Pohjois Suomo , and signed asimilar agreement , '' said Tatu Hauhio , managing director ofCramo Finland .",1
"In June it sold a 30 percent stake to Nordstjernan , and the investment group has now taken up the option to acquire EQT 's remaining shares .",1
STOCK EXCHANGE ANNOUNCEMENT 20 July 2006 1 ( 1 ) BASWARE SHARE SUBSCRIPTIONS WITH WARRANTS AND INCREASE IN SHARE CAPITAL A total of 119 850 shares have been subscribed with BasWare Warrant Program .,1
The new plant is planned to have an electricity generation capacity of up to 350 megawatts ( MW ) and the same heat generation capacity .,1
"- So , the sales growth of cars considerably influence on the tires market '' .",1
"A maximum of 666,104 new shares can further be subscribed for by exercising B options under the 2004 stock option plan .",1
"As a result of the share issue , the number of the company 's shares increases by 391,630 shares and the share capital by a total of EUR 15,665.20 .",1
"Finnish real estate investor Sponda Plc said on Wednesday 12 March that it has signed agreements with Danske Bank A-S , Helsinki Branch for a 7-year EUR150m credit facility and with Ilmarinen Mutual Pension Insurance Company for a 7-year EUR50m credit facility .",1
"On the route between Helsinki in Finland and Tallinn in Estonia , cargo volumes increased by 36 % , while cargo volumes between Finland and Sweden fell by 9 % .",1
"Other measures included increasing synergies and economies of scale within the Grimaldi Group and personnel adjustments , divestments and redelivery of excess tonnage .",1
TELECOMWORLDWIRE-7 April 2006-TJ Group Plc sells stake in Morning Digital Design Oy Finnish IT company TJ Group Plc said on Friday 7 April that it had signed an agreement on selling its shares of Morning Digital Design Oy to Edita Oyj .,1
"The 718,430 new Series A shares will become subject to trading on the Helsinki Stock Exchange 's Main List , together with the old Series A shares , on July 3 , 2006 .",1
The fuel purchase contracts have been signed with three months ' delivery from this September to November .,1
Tiimari operates 194 stores in six countries -- including its core Finnish market -- and generated a turnover of 76.5 mln eur in 2005 .,1
No blind-spots coming from 1 vantage point allows investigators to see the whole story in high resolution with no unbroken video .,1
Kalmar Espana generated net sales of some 11.3 mln euro $ 14.8 mln in 2005 .,1
"A structures BIM ( building information modeling ) software from Tekla , a model-based software provider , has been adopted for the construction management and delivery of a university project in Abu Dhabi .",1
Aviation Systems Maintenance is based in Kansas and generated net sales of USD 2.6 million for 2008 .,1
"Editor 's note : Grimaldi generated a 1.7 bln euro ( $ 2.182 bln ) turnover in 2005 , ANSA reported on May 29 , 2006 .",1
"In 2007 , Contempus generated revenue of NOK 69.3 ( approx .",1
Incap estimates it will generate a revenue of 10 mln euro ( $ 13.2 mln ) from its Indian operations for 2007 .,1
Its total annual revenue comes up to about 160 mln zloty ( $ 56.9 mln-42 .3 mln euro ) .,1
"M-real generated a turnover of EUR5 .6 bn in 2006 and has 15,500 employees .",1
The firm generated sales of 187 mln eur in 2005 .,1
Vacon will supply drives to Ruselprom in the power range from 200 kW up to 2 MW .,1
Finnish Componenta has published its new long-term strategy for the period 2011-2015 with the aim of growing together with its customers .,1
"Olvi 's target is to strengthen its market share in soft drinks , mineral waters , ciders , long drinks , and energy drinks .",1
The Finnish company Stockmann has signed the contract with the company Technopolis .,1
"According to its notice , Skandinaviska Enskilda Banken AB publ Helsinki Branch has on 10 August 2009 divested in total 11,958,000 Alma Media shares to Ilkka-Yhtyma Oyj and Kaleva Kustannus Oy , as the conditions of the agreement made by the companies on 1 July 2009 fulfilled .",1
"As previously announced , GeoSentric Oyj entered into financing agreements with its lead investor on June 30 , 2010 enabling the Company to receive financing up to the aggregate amount of 6M .",1
"At the same time , the market for automated liquid handling devices is already larger than that for pipettes , according to Biohit .",1
Efore 's CEO Reijo Maihaniemi said that the company has developed and already delivered power supply units to respective systems based on this technology to Chinese sector company ZTE Corp SHE : 000063 .,1
Finnish Talvivaara Mining Co HEL : TLV1V said Thursday it had picked BofA Merrill Lynch and JPMorgan NYSE : JPM as joint bookrunners of its planned issue of convertible notes worth up to EUR250m USD332m .,1
"Lemminkainen Oyj said that it has signed credit agreements with Nordea Bank STO : NDA , Pohjola Bank HEL : POH1S , Sampo Bank HEL : SAMAS and Svenska Handelsbanken STO : SHB A .",1
Pohjola could increase its stake to 45 % in 2013 .,1
Scandic Feed will also diversify Tosno 's product portfolio further .,1
The agreement with JM is one in a series of contracts that TeliaSonera has signed in recent months with residential construction and real estate management companies in Sweden .,1
"The estimated value of the contract is EUR12 .4 m. Vaisala , headquartered in Helsinki in Finland , develops and manufactures electronic measurement systems for meteorology , environmental sciences , traffic and industry .",1
"The mall is part of the Baltic Pearl development project in the city of St Petersburg , where Baltic Pearl CJSC , a subsidiary of Shanghai Foreign Joint Investment Company , is developing homes for 35,000 people .",1
"The new facility , to be known as Technopolis Pulkovo , will introduce to the Russian market an entirely new concept of creating , operating and growing a commercially-funded science and technology park to support the growth of knowledge-intensive companies .",1
Vacon controls a further 5 % of the company via investment fund Power Fund I. EUR 1.0 = USD 1.397,1
"` This order is included in Wartsila 's order book in the second quarter , ' the company added .",1
`` Management decided at the end of 2005 to increase cathode copper capacity .,1
4 ) Complete name of the shareholder : Otto Henrik Bernhard Nyberg 5 ) Further information : The amount of shares now transferred corresponds to 5.68 % of the total number of shares in Aspo Plc. .,1
"A data processing unit collects the data , calculates RVR values and provides the data to users via various interfaces .",1
"ALEXANDRIA , Va. , March 28 -- Pertti Salmi and Hanna Vuolteenaho , both of Oulu , Finland , and Sami Viitasaari of Ii , Finland , have developed an ornamental design for a handset , the U.S. Patent & Trademark Office announced .",1
"ALEXANDRIA , Va. , Oct. 3 -- Markka A. Oksanen and Harald Kaaja , both of Helsinki , Finland , Juha Salokannel of Kangasala , Finland , and Arto Palin of Viiala , Finland , have developed a system for providing communications security .",1
"As earlier reported , Nokian Tyres is building a plant in the town of Vsevolozhsk in Russia 's Leningrad Region with an annual production capacity of 4 million tires .",1
"Biohit , Inc. , has expanded its mLINE Family of Pipettors with the addition of the NEW 1-10 ml volume range .",1
"Capman , the Finnish alternative asset manager , has made an acquisition for its Helsinki-focused vehicle , Real Estate Fund I. The fund has bought a seven-story office built in 1973 that underwent refurbishment at the end of the 1990s .",1
"Compared with the FTSE 100 index , which rose 51.5 points ( or 0.9 % ) on the day , this was a relative price change of -0.6 % .",1
"Deliveries are to start later in 2010 , and the volume will increase in the years 2011-2012 .",1
"Finnish heat-retaining fireplaces maker Tulikivi Oyj said on August 29 , 2007 that its local tiled stoves and utility ceramics subsidiary Kermansavi Oy will merge into Tulikivi by means of absorption in order to streamline the latest 's corporate structure .",1
"German Commerzbank AG 's Hamburg Branch and US JP Morgan ( NYSE : JPM ) participated as arrangers , and Dutch ING ( AMS : INGA ) as co-arranger .",1
"In April 2005 , Neste separated from its parent company , Finnish energy company Fortum , and became listed on the Helsinki Stock Exchange .",1
"In Russia , Raisio 's Food Division 's home market stretches all the way to Vladivostok .",1
Increase in the number of shares is based on the option rights which were granted to the management of the company under the stock option plan 2006 .,1
It has some 30 offices worldwide and more than 90 pct of its net sales are generated outside Finland .,1
It has80 branches in Finland with annual revenue in Finland of ?,1
"MILAN ( AFX ) - The Italian shipping group Grimaldi has increased its stake in the Finnish company Finnlines to 35.4 pct from the 30.5 pct held in June , according to news agency ANSA .",1
Nokia Messaging 1.1 enables customers to receive e-mails from up to 10 e-mail accounts on their mobile phone supporting all POP or IMAP e-mail services .,1
SHARE REPURCHASE 11.01.2008 In the Helsinki Stock Exchange On behalf of Sampo plc Danske Bank A-S Helsinki Branch,1
Solidium picked up Tikkurila shares as a dividend at a book value of EUR15 .80 per share .,1
"Takoma will carry out the transaction by acquiring the entire share capital of Moventas Parkano Oy , which runs the factory in Parkano , southern Finland .",1
"The building owner and developer , Sun Hung Kai Properties Group , is one of the largest property companies in Hong Kong , developing all types of premium residential and commercial projects for sale and investment .",1
The companies ' aim is to finalize the negotiations and sign the contracts at the start of October 2008 .,1
The companies signed the letter of intent for the sale on 17 September 2010 and envisaged to seal the actual agreement on 1 January 2011 .,1
"The contract , which was signed yesterday , will run for five years and includes a two-year extension option .",1
"The contract covers installation , training and start-up services .",1
"The contract value amounts to about EUR11m , the company added .",1
"The expanded agreement covers the sale , marketing and distribution of Benefon 's navigation and locator devices in China .",1
TietoEnator signed an agreement to acquire Indian research and development ( R&D ) services provider and turnkey software solutions developer Fortuna Technologies Pvt. Ltd. for 21 mln euro ( $ 30.3 mln ) in September 2007 .,1
To be number one means creating added value for stakeholders in everything we do .,1
- Provides summary of the medical equipment pipeline products that the company is developing .,1
"`` Of course , we are in talks with all those coming up with new projects that involve material handling , '' Konecranes President and CEO Pekka Lundmark said , when asked whether it was talking to Reliance Industries for supplying equipment to its upcoming refinery in Jamnagar .",1
`` Ruukki is now included on DJSI World for the second year running and the European DJSI STOXX for the third year running .,1
`` The sale of the oxygen measurement business strengthens our goal to focus on our chosen market segments .,1
"A corresponding increase of 85,432.50 euros in Ahlstrom 's share capital has been entered in the Trade Register today .",1
"A In August 2007 , Latvijas Finieris ordered all production lines for a new green veneer mill to be built in Ukmerge , central Lithuania .",1
Finnish house manufacturers are targeting the strongly growing one-family house market in Russia .,1
Aldata said that there are still a number of operational aspects to be defined between it and Microsoft and further details of the product and market initiatives resulting from this agreement will be available at a later date .,1
"ALEXANDRIA , Va. , July 11 -- Hannu Kahonen of Juuka , Finland , has developed an ornamental design for a handle for fire pit door , the U.S. Patent & Trademark Office announced .",1
"ALEXANDRIA , Va. , May 16 -- Kenneth Bower of Vista , Calif. , has developed an ornamental design for a handset , the U.S. Patent & Trademark Office announced .",1
Aspocomp intends to set up a plant to manufacture printed circuit boards with an investment of Rs310 crore .,1
"Baltic Pearl CJSC , a subsidiary of Shanghai Foreign Joint Investment Company , is developing a project in St Petersburg , comprising about a million square meters of residential space , two hospitals and several schools and nurseries .",1
"Biohit Oyj develops , manufactures and markets liquid handling products and diagnostic test systems for use in research , healthcare and industrial laboratories .",1
Calls to the switchboard and directory services have decreased significantly since our employees now have up-to-date contact information from all their colleagues and customers on their phone and can place the call directly .,1
"Cargotec 's share capital after the increase totals 64,046,460 euros .",1
"Cargotec 's share capital after the increase totals EUR 64,299,180 .",1
Finnish food company Raisio Oyj HEL : RAIVV said on Friday it has wrapped up the divestment of its margarine operations to US sector player Bunge Ltd NYSE : BG for EUR80m USD119 .2 m .,1
Finnish paper maker UPM-Kymmene Corp. on Monday announced the sale of its wrapping unit Walki Wisa to the CapMan investment group in a move to further concentrate on its core business .,1
Following the increase the company+óEUR TM s capital totals 5.5 mln Romanian lei $ 1.98 mln-1 .56 mln euro .,1
"In 2008 , it generated net sales of EUR 9.3 million USD 13.1 m .",1
"In August , Latvijas Finieris ordered all production lines for a new green veneer mill to be built in Ukmerge , Lithuania .",1
Jacobs has been supporting Storengy 's investment of developing storage sites since 2006 as owner 's engineer .,1
"Mr Ashley , deputy executive chairman of Sports Direct , sold a 43pc stake in the company for more than pounds 900m at the time of the float .",1
Rental of building equipment accounted for 88 percent of the operating income .,1
"Ruukki 's delivery includes steel structures , including installation , for Krakeroy bascule bridge and steel piles for the bridge foundations .",1
Sanoma will continue to focus on investing in digital media and on strengthening its market positions .,1
Stockmann was established in 1862 in Finland and it became the first foreign company to enter Russia 's retail trade market in 1989 .,1
"The acquisition is part of Suomen Helasto 's strategy to expand the LukkoExpert Security chain , Suomen Helasto CEO Kimmo Uusimaki said .",1
"The broad-based WIG index ended Thursday 's session 0.1 pct up at 65,003.34 pts , while the blue-chip WIG20 was 1.13 down at 3,687.15 pts .",1
The business to be divested generates consolidated net sales of EUR 60 million annually and currently has some 640 employees .,1
"The company generates net sales of about 600 mln euro $ 775.5 mln annually and employs 6,000 .",1
The company plans to spend the proceeds from the rights offering for strengthening its balance sheet .,1
"The contract covers the manufacturing , surface-treatment and installation of the steel structures .",1
"The corresponding increase in the share capital , EUR422 ,754 , has been entered in the Trade Register today .",1
"The corresponding increase in the share capital , in total EUR 300,00 was registered in the Finnish Trade Register on May 8 , 2008 .",1
"The corresponding increase in the share capital due to these subscriptions with the warrants , in total EUR 1,860.74 , was registered with the Finnish Trade Register on January 4 , 2008 .",1
"The corresponding share capital increase , EUR 1,012,945.50 was entered in the Trade Register today .",1
The order also includes start-up and commissioning services .,1
"The order consists of capacity expansion , maintenance services and new charging functionality , the company said .",1
The phones are targeted at first time users in growth markets .,1
"The repayment of EUR 105 million debenture bonds is related to the Company 's previous announcement on October 21 , 2009 to collect irrevocable selling commitments from the holders of its subordinated debenture bonds .",1
The revenues of the business reached NOK 12 million for 2008 .,1
Tielinja generated net sales of 7.5 mln euro $ 9.6 mln in 2005 .,1
"Tikkurila Powder Coatings has some 50 employees at its four paint plants , which generated revenues of EUR2 .4 m USD3 .3 m in 2010 .",1
U.S. District Judge Douglas P. Woodlock yesterday extended a Jan. 17 temporary restraining order until March 7 .,1
"UK 's Sarantel to outsource part of its processes to Elcoteq plant in Estonia LONDON , Oct 13 , BNS - The British miniature antennas maker Sarantel has signed an agreement to outsource its assembly test and supply chain processes to the plant of Elcoteq in the Estonian capital Tallinn .",1
"Under the rental agreement , Stockmann was committed to invest in the building of a bridge over the Gogol Street or build an underground tunnel for crossing the street by 2004 .",1
We have made long-term investments in developing the system 's implementation model .,1
"With this subscription , Fortum 's ownership in TGK-10 has increased to slightly over 76 % of shares and voting rights .",1
VNH generates annual net sales of about 5 mln eur and employs 21 people .,1
"Rautakesko 's business operations in Norway and Russia , acquired in July 2005 , are included in the figures of the comparable period , impacting sales growth starting from August .",1
